{
  "conversation_id": "conv_a1b2c3d4e5f6g7h8i9j0",
  "analysis_date": "2025-12-11T01:15:00Z",
  "conversation_timestamp": "2025-12-10T18:30:00Z",
  "conversation_title": "Building a Distributed Task Queue System",
  "conversation_summary": "In-depth discussion about designing and implementing a distributed task queue system using Redis and Python. Covered architecture patterns, scalability considerations, error handling, and monitoring strategies.",
  
  "technical_insights": [
    {
      "topic": "Distributed Systems",
      "insight": "Implemented producer-consumer pattern with Redis as message broker. Discussed trade-offs between RabbitMQ and Redis for task queuing, favoring Redis for simpler setup and better performance for small-to-medium scale applications.",
      "complexity_level": "intermediate",
      "relevance_score": 0.95
    },
    {
      "topic": "Python Concurrency",
      "insight": "Explored asyncio for handling concurrent task processing. Identified proper use of async/await patterns and discussed thread pool vs process pool executors for CPU-bound vs I/O-bound tasks.",
      "complexity_level": "advanced",
      "relevance_score": 0.88
    },
    {
      "topic": "Error Handling",
      "insight": "Designed retry mechanism with exponential backoff. Implemented dead-letter queues for failed tasks and circuit breaker pattern to prevent cascading failures.",
      "complexity_level": "intermediate",
      "relevance_score": 0.92
    }
  ],
  
  "problem_solving_patterns": {
    "approach": "systematic",
    "thinking_style": "analytical and architecture-first",
    "patterns_identified": [
      "Breaks down complex systems into smaller components",
      "Considers scalability and edge cases early in design phase",
      "Asks clarifying questions about requirements before implementation",
      "References industry best practices and battle-tested solutions",
      "Iterates on design based on trade-off analysis"
    ],
    "strengths": [
      "Strong architectural thinking",
      "Good understanding of distributed systems concepts",
      "Considers operational aspects (monitoring, debugging)",
      "Balances theoretical knowledge with practical constraints"
    ],
    "areas_for_improvement": [
      "Could explore more alternative solutions before committing",
      "Security considerations could be more prominent in initial design"
    ]
  },
  
  "communication_style": {
    "clarity": "high",
    "technical_depth": "advanced",
    "question_quality": "excellent",
    "characteristics": [
      "Asks precise, context-rich questions",
      "Provides relevant background information",
      "Responds well to technical details",
      "Shows genuine curiosity and deep understanding",
      "Uses proper technical terminology"
    ],
    "engagement_level": "highly engaged",
    "follow_up_questions": 12,
    "average_message_length": 245
  },
  
  "key_skills": [
    {
      "skill": "Python Development",
      "proficiency": "advanced",
      "evidence": "Demonstrated deep knowledge of asyncio, multiprocessing, and production-ready code patterns",
      "confidence": 0.93
    },
    {
      "skill": "Distributed Systems",
      "proficiency": "intermediate-advanced",
      "evidence": "Understanding of message queues, eventual consistency, CAP theorem, and fault tolerance patterns",
      "confidence": 0.87
    },
    {
      "skill": "System Architecture",
      "proficiency": "intermediate",
      "evidence": "Ability to design scalable systems with proper separation of concerns and component interaction",
      "confidence": 0.85
    },
    {
      "skill": "Redis",
      "proficiency": "intermediate",
      "evidence": "Knowledge of Redis data structures, pub/sub, and usage as message broker",
      "confidence": 0.82
    },
    {
      "skill": "Software Design Patterns",
      "proficiency": "intermediate",
      "evidence": "Applied producer-consumer, circuit breaker, and retry patterns appropriately",
      "confidence": 0.88
    }
  ],
  
  "topics_of_interest": [
    {
      "topic": "Backend Development",
      "frequency": 8,
      "depth": "deep",
      "subcategories": ["API Design", "Microservices", "Database Optimization"]
    },
    {
      "topic": "Distributed Systems",
      "frequency": 7,
      "depth": "deep",
      "subcategories": ["Message Queues", "Consensus Algorithms", "Service Mesh"]
    },
    {
      "topic": "Python Ecosystem",
      "frequency": 9,
      "depth": "very deep",
      "subcategories": ["Async Programming", "Performance Optimization", "Testing Frameworks"]
    },
    {
      "topic": "DevOps & Infrastructure",
      "frequency": 5,
      "depth": "moderate",
      "subcategories": ["Docker", "Kubernetes", "CI/CD", "Monitoring"]
    },
    {
      "topic": "System Reliability",
      "frequency": 6,
      "depth": "deep",
      "subcategories": ["Error Handling", "Observability", "Resilience Patterns"]
    }
  ],
  
  "project_interests": [
    {
      "project_type": "Distributed Task Queue System",
      "motivation": "Building production-ready infrastructure for background job processing",
      "current_stage": "design",
      "technologies": ["Python", "Redis", "Docker", "FastAPI"],
      "scope": "medium",
      "timeline": "2-3 months",
      "challenges": [
        "Ensuring message delivery guarantees",
        "Handling worker scaling",
        "Implementing proper monitoring and alerting"
      ]
    },
    {
      "project_type": "Microservices Migration",
      "motivation": "Learning modern architecture patterns and service decomposition",
      "current_stage": "research",
      "technologies": ["Python", "gRPC", "Kubernetes", "PostgreSQL"],
      "scope": "large",
      "timeline": "6+ months"
    }
  ],
  
  "confidence_score": 0.89,
  
  "metadata": {
    "total_messages": 47,
    "conversation_duration_minutes": 125,
    "code_snippets_shared": 8,
    "external_resources_referenced": 5,
    "model_version": "gpt-4",
    "language": "en",
    "user_timezone": "EST"
  },
  
  "learning_trajectory": {
    "knowledge_progression": "Building on distributed systems fundamentals to implement real-world solutions",
    "conceptual_gaps_filled": [
      "Difference between at-least-once and exactly-once delivery",
      "When to use Redis vs RabbitMQ for message queuing",
      "Circuit breaker implementation patterns"
    ],
    "next_learning_steps": [
      "Explore message queue observability tools (Prometheus, Grafana)",
      "Deep dive into Celery internals and alternatives",
      "Study distributed tracing with OpenTelemetry"
    ]
  },
  
  "actionable_insights": [
    {
      "category": "skill_development",
      "insight": "Strong foundation in Python and distributed systems. Ready for senior backend engineer roles focusing on infrastructure.",
      "action": "Consider contributing to open-source distributed systems projects (e.g., Celery, RQ) to gain deeper expertise",
      "priority": "high"
    },
    {
      "category": "project_recommendation",
      "insight": "Current task queue project aligns well with skills and interests",
      "action": "Document design decisions and write blog posts about implementation challenges to build portfolio",
      "priority": "medium"
    },
    {
      "category": "learning_path",
      "insight": "Limited exposure to security aspects in distributed systems",
      "action": "Study authentication, authorization, and secure communication patterns in microservices",
      "priority": "medium"
    },
    {
      "category": "tool_exploration",
      "insight": "Strong Python background, could benefit from exploring complementary technologies",
      "action": "Experiment with Go for high-performance services or Rust for systems programming",
      "priority": "low"
    }
  ],
  
  "notion_metadata": {
    "database_id": "example-database-id-12345",
    "page_id": null,
    "sync_status": "pending",
    "last_synced": null,
    "sync_version": "1.0.0",
    "tags": ["distributed-systems", "python", "redis", "backend", "architecture"],
    "category": "technical",
    "priority": "high"
  },
  
  "validation": {
    "schema_version": "1.0.0",
    "validated_at": "2025-12-11T01:15:00Z",
    "validation_status": "passed",
    "data_quality_score": 0.95,
    "completeness": {
      "required_fields": 1.0,
      "optional_fields": 0.92
    }
  }
}
