{
  "conversation_id": "conv_sample123",
  "analysis_date": "2025-12-11T22:00:00Z",
  "conversation_timestamp": "2025-12-11T20:30:00Z",
  "conversation_title": "Building a Full-Stack Application with Node.js",
  "conversation_summary": "Discussed architecture, best practices, and implementation strategies for building a full-stack application using Node.js, Express, and React.",
  "technical_insights": [
    {
      "topic": "Node.js Architecture",
      "insight": "Understanding MVC pattern and separation of concerns in Node.js applications",
      "complexity_level": "intermediate",
      "relevance_score": 0.9
    },
    {
      "topic": "API Design",
      "insight": "RESTful API design principles and best practices for scalability",
      "complexity_level": "intermediate",
      "relevance_score": 0.85
    },
    {
      "topic": "Database Integration",
      "insight": "MongoDB integration with Mongoose ODM for data modeling",
      "complexity_level": "intermediate",
      "relevance_score": 0.8
    }
  ],
  "problem_solving_patterns": {
    "approach": "systematic",
    "thinking_style": "analytical and structured",
    "patterns_identified": [
      "Breaking down complex problems into manageable components",
      "Focusing on scalability and maintainability from the start",
      "Considering security implications early in design"
    ],
    "strengths": [
      "Clear articulation of requirements",
      "Good understanding of software architecture principles",
      "Proactive about error handling and edge cases"
    ],
    "areas_for_improvement": [
      "Could explore more advanced design patterns",
      "Consider microservices architecture for larger scale"
    ]
  },
  "communication_style": {
    "clarity": "high",
    "technical_depth": "intermediate",
    "question_quality": "excellent",
    "characteristics": [
      "Asks well-structured questions",
      "Provides context for problems",
      "Seeks to understand underlying principles"
    ],
    "engagement_level": "highly engaged",
    "follow_up_questions": 8,
    "average_message_length": 150
  },
  "key_skills": [
    {
      "skill": "Node.js",
      "proficiency": "intermediate",
      "evidence": "Demonstrated understanding of async/await, middleware, and Express framework",
      "confidence": 0.85
    },
    {
      "skill": "JavaScript/ES6+",
      "proficiency": "advanced",
      "evidence": "Uses modern JavaScript features appropriately, understands closures and promises",
      "confidence": 0.9
    },
    {
      "skill": "API Design",
      "proficiency": "intermediate",
      "evidence": "Asks informed questions about REST principles and HTTP methods",
      "confidence": 0.8
    },
    {
      "skill": "Database Management",
      "proficiency": "beginner-intermediate",
      "evidence": "Understanding of basic CRUD operations and data modeling",
      "confidence": 0.7
    }
  ],
  "topics_of_interest": [
    {
      "topic": "Full-Stack Development",
      "frequency": 12,
      "depth": "deep",
      "subcategories": ["Frontend", "Backend", "DevOps"]
    },
    {
      "topic": "Node.js Ecosystem",
      "frequency": 10,
      "depth": "deep",
      "subcategories": ["Express", "npm packages", "Performance optimization"]
    },
    {
      "topic": "Software Architecture",
      "frequency": 8,
      "depth": "moderate",
      "subcategories": ["Design patterns", "Scalability", "Best practices"]
    }
  ],
  "project_interests": [
    {
      "project_type": "Full-Stack Web Application",
      "motivation": "Building a production-ready application to enhance portfolio",
      "current_stage": "design",
      "technologies": ["Node.js", "Express", "React", "MongoDB"],
      "scope": "medium",
      "timeline": "2-3 months",
      "challenges": [
        "Implementing authentication and authorization",
        "Optimizing database queries",
        "Setting up CI/CD pipeline"
      ]
    }
  ],
  "confidence_score": 0.87,
  "metadata": {
    "total_messages": 24,
    "conversation_duration_minutes": 65,
    "code_snippets_shared": 5,
    "external_resources_referenced": 3,
    "model_version": "gpt-4",
    "language": "en",
    "user_timezone": "EST"
  },
  "learning_trajectory": {
    "knowledge_progression": "Progressed from basic Node.js concepts to understanding full application architecture",
    "conceptual_gaps_filled": [
      "Middleware execution order",
      "Error handling best practices",
      "Environment configuration management"
    ],
    "next_learning_steps": [
      "Explore testing frameworks (Jest, Mocha)",
      "Learn about Docker and containerization",
      "Study advanced security practices (OWASP Top 10)"
    ]
  },
  "actionable_insights": [
    {
      "category": "skill_development",
      "insight": "Strong foundation in Node.js, ready to explore advanced topics",
      "action": "Study design patterns (Factory, Singleton, Observer) and apply to current project",
      "priority": "high"
    },
    {
      "category": "project_recommendation",
      "insight": "Good understanding of full-stack development principles",
      "action": "Build a complete CRUD application with authentication as a portfolio piece",
      "priority": "high"
    },
    {
      "category": "learning_path",
      "insight": "Would benefit from learning testing and deployment",
      "action": "Learn Jest for unit testing and explore deployment options (Heroku, AWS, Vercel)",
      "priority": "medium"
    }
  ],
  "notion_metadata": {
    "database_id": null,
    "page_id": null,
    "sync_status": "pending",
    "last_synced": null,
    "sync_version": "1.0.0",
    "tags": ["full-stack", "nodejs", "learning", "architecture"],
    "category": "learning",
    "priority": "high"
  },
  "validation": {
    "schema_version": "1.0.0",
    "validated_at": "2025-12-11T22:00:00Z",
    "validation_status": "passed",
    "data_quality_score": 0.95,
    "completeness": {
      "required_fields": 1.0,
      "optional_fields": 0.9
    },
    "warnings": [],
    "errors": []
  }
}
